{
  "id": "sh1",
  "match_id": "m1",
  "side": "home",
  "lens": "analyst",
  "lang": "en-GB",
  "created_at": "2026-10-22T10:05:00Z",
  "segments": [
    {
      "chapter_title": "How they broke the press",
      "overlay": {
        "id": "ov1",
        "stream_tc": null,
        "match_tc": 1834000,
        "surface": "broadcast",
        "claims": [
          {
            "id": "c1",
            "text_slot": "gap_m",
            "value": 11.4,
            "unit": "m",
            "tool_call": {
              "id": "tc1",
              "name": "line_gap",
              "args": {
                "t": 1834000,
                "team": "away"
              },
              "output_hash": "sha256:0f3a"
            },
            "evidence_window": {
              "start_t": 1832000,
              "end_t": 1836000
            },
            "tolerance": 0.5,
            "verified": true
          }
        ],
        "strokes": [
          {
            "id": "s1",
            "shape": "pass_lane",
            "geometry_m": {
              "points": [
                [
                  10.2,
                  -4.0
                ],
                [
                  31.5,
                  6.8
                ]
              ]
            },
            "style": {
              "color": "chalk",
              "width": 0.4
            },
            "cue_id": "k1",
            "lead_ms": 150,
            "duration_ms": 600,
            "claim_ids": [
              "c1"
            ]
          },
          {
            "id": "s2",
            "shape": "ring",
            "geometry_m": {
              "player_id": "h8",
              "radius": 2.0
            },
            "cue_id": "k2"
          }
        ],
        "script": {
          "ssml": "<speak>Look at the <bookmark mark='k1'/>gap, and <bookmark mark='k2'/>him.</speak>",
          "text": "Look at the gap, and him.",
          "cues": [
            {
              "cue_id": "k1",
              "offset_ms": 620
            },
            {
              "cue_id": "k2",
              "offset_ms": 1410
            }
          ],
          "words": [
            {
              "text": "gap",
              "offset_ms": 620,
              "duration_ms": 260
            }
          ]
        },
        "camera": {
          "preset": "broadcast",
          "target": [
            20.0,
            0.0
          ],
          "zoom": 1.2
        },
        "lens": "casual",
        "side": "neutral",
        "lang": "en-GB",
        "approval": {
          "state": "approved",
          "by": "operator",
          "at": "2026-10-22T10:00:00Z"
        },
        "gate": {
          "passed": true,
          "scores": {
            "groundedness": 0.97
          }
        }
      }
    }
  ]
}